64;Fire, flood and monodominance of Tabebuia aurea in Pantanal;2021;"Manrique-Pineda, Daniel Armando; de Souza, Evaldo Benedito; Paranhos Filho, Antonio Conceicao; Encina, Cesar Claudio Caceres; Damasceno-Junior, Geraldo Alves";Colombiano;UFMS;MS;FOREST ECOLOGY AND MANAGEMENT;4.384;1;;"Environmental filters; Monodominant stands; Remote sensing;Phytosociology;Earth-mounds";19°18?44.30?S ,57°37?10.23?W;Paratudal;arvores;não;sim;não;não;coleta de campo;Under higher fire frequency, abundance, richness and basal area of all species decreased with increase of water level. However, the abundance and basal area of Tabebuia aurea remained higher than those of other species. Under lower fire frequency, the abundance and richness of all species in the community increased with water level. Basal area, however, decreased with increasing water level, such that individuals with larger basal area were found under lower fire frequency. Under high fire frequency earth-mounds protected T. aurea individuals from fire and flood. Earth-mounds influenced species richness and basal area only under medium-low fire frequency. Results show that monodominance of T. aurea benefits from the interaction between fire and flood, with some help from earth-mounds. Individuals of other tree species, show tolerance to high flood levels or high fire frequencies, but not the interaction between fire and flood. This dynamic strengthens the monodominance of T. aurea, as the number of individuals also increases. Our results show that flood and fire are important to the conservation of this monodominant community.;;;;;;;;
65;The 2020 Brazilian Pantanal fires;2021;"Pletsch, Mikhaela A. J. S.; Silva Junior, Celso H. L.; Penha, Thales V.; Korting, Thales S.; Silva, Maria E. S.; Pereira, Gabriel; Anderson, Liana O.; Aragao, Luiz E. O. C.";Brasileira;INPE;SP;ANAIS DA ACADEMIA BRASILEIRA DE CIENCIAS;-;1;;-;Pantanal;-;-;não;não;sim;não;artigo de opinião;;parece um trabalho de congresso;;;;;;;
1;Indigenous brigades change the spatial patterns of wildfires, and the influence of climate on fire regimes;2022;"Oliveira, Maxwell R.; Ferreira, Bruno H. S.; Souza, Evaldo B.; Lopes, Aline A.; Bolzan, Fabio P.; Roque, Fabio O.; Pott, Arnildo; Pereira, Alexandre M. M.; Garcia, Leticia C.; Damasceno Jr, Geraldo A.; Costa, Ademilson; Rocha, Mesaque; Xavier, Silvio; Ferraz, Rubens A.; Ribeiro, Danilo B.";Brasileira;UFMS;MS;Journal of Applied Ecology;6.86;1;A1;"controlled burning; fire management policies; indigenous fire brigades; integrated fire management; Pantanal; wetland; wildfire management; wildfire reduction"; Kadiwéu IT ;Várias;-;Não;Sim;Não;não;Banco de dados (dataset de áreas queimadas), comparação do histórico através dos anos;"O manejo de incêndios pelas brigadas indígenas reduziu em 80% a frequência de incêndios nas áreas com alta frequência de incêndios. A gestão também reduziu em 53% o tamanho da área queimada e a influência do clima sobre a área total queimada. a área afetada pelos incêndios é influenciada principalmente pelas chuvas anuais na ausência de brigadas indígenas; em contrapartida, os fatores climáticos não puderam explicar a variação da área queimada no período sem brigadas indígenas.";;;;;;;;
2;Determinants of Fire Impact in the Brazilian Biomes;2022;"Oliveira, Ubirajara; Soares-Filho, Britaldo; Bustamante, Mercedes; Gomes, Leticia; Ometto, Jean P.; Rajao, Raoni";Brasileira;UFMG;MG;FRONTIERS IN FORESTS AND GLOBAL CHANGE;4.332;1;s/ classificação;modeling, deforestation, land use change, protected areas, native vegetation;Pantanal, Cerrado, Amazônia;-;-;Não;Sim;Não;não;Banco de dados (dataset de áreas queimadas);"Os três biomas do estudo apresentaram fogo de alto impacto; O clima é o principal determinante do impacto do fogo no Cerrado e Pantanal, já na Amazônia é a ação humana; há uma tendência de aumento de fogo de alto impacto nesses biomas";;;;;;;;
15;Increased burned area in the Pantanal over the past two decades;2022;"Correa, Danielle Blazys; Alcantara, Enner; Libonati, Renata; Massi, Klecia Gili; Park, Edward";Brasileira;UNESP;SP;Science of The Total Environment;10.753;1;A2;"LULC changes; Burned areas; Tropical wetland; Extreme events";Pantanal;-;-;não;Sim;não;não;Sensoriamento remoto;"Fire patterns in the Pantanal wetland in the last two decades were analyzed by mapping burned area; Among land covers, grassland was the most vulnerable to fire; Mega-fires in 2020 have occurred exceptionally within forest; Large scale synoptic view is necessary for better management of fires in Pantanal.";;;;;;;;
16;Human Activity Behind the Unprecedented 2020 Wildfire in Brazilian Wetlands (Pantanal);2022;"de Magalhaes Neto, Newton; Evangelista, Heitor";Brasileira;UERJ;RJ;FRONTIERS IN ENVIRONMENTAL SCIENCE;5.411;1;C;"burn severity; extreme fire event; drought; climate change; land use/cover change";Pantanal;Várias;-;não;Sim;não;não;"Banco de dados; Sensoriamento Remoto";"Most impacted conservation units had more than 80% of their area burned and exhibited moderate low-high burn severity; The 2020 unprecedented fire crisis in the Pantanal was caused by the combination of human presence, represented by accessibility through roads and waterways, and an extremely dry climate.";;;;;;;;
17;Lightning patterns in the Pantanal: Untangling natural and anthropogenic-induced wildfires;2022;"Menezes, Lucas S.; de Oliveira, Aline M.; Santos, Filippe L. M.; Russo, Ana; de Souza, Rodrigo A. F.; Roque, Fabio O.; Libonati, Renata";Brasileira;UFRJ;RJ;Science of The Total Environment;10.753;1;A2;"Pantanal; Fires; Burned area; Lightning; VIIRS; STARNET";Pantanal;-;-;não;Sim;não;não;Sensoriamento remoto;"Globally, Brazil is one of the regions with the highest lighting and fire activity; We use 6-year remote sensing data to relate lighting and fire in the Pantanal; Human activity is the main source of ignition accounting for 84% of the burnt area; Natural-caused fires account for only 5% of the total scars; Most of the fires with extension larger than 1000 ha were not related to lighting.";;;;;;;;
18;Changes in land use enhance the sensitivity of tropical ecosystems to fire-climate extremes;2022;"Kumar, Sujay; Getirana, Augusto; Libonati, Renata; Hain, Christopher; Mahanama, Sarith; Andela, Niels";EUA;NASA Goddard Space Flight Center;Maryland;SCIENTIFIC REPORTS;5.516;1;B1;-;Pantanal;-;-;não;Sim;não;não;Sensoriamento remoto;"We demonstrate that the fres were fueled by an exceptional multi-year drought, but dry conditions solely could not explain the spatial patterns of burning; Our analysis reveals how human-caused fres exacerbated drought efects on natural ecosystem within the Pantanal, with large burned fractions primarily over natural (52%), and low cattle density areas (44%) in 2020;  The post-fre ecosystem and hydrology changes also had strong ecological efects, with vegetation productivity less than ? 1.5 ? over more than 30% of the natural and conservation areas; In contrast to more managed areas, there was a clear decrease in evaporation (by ~ 9%) and an increase in runof (by~ 5%) over the natural areas, with long-term impacts on ecosystem recovery and fre risk; This study provides the frst tropical evidence outside rainforests of the synergy between climate, land management and fres, and the associated impacts on the ecosystem and hydrology over the largest contiguous wetlands in the world.";;;;;;;;
24;Quantifying the post-fire recovery of taxonomic and functional diversity of dung beetles in the Brazilian Pantanal;2022;"Goncalves, Tais Felix; Correa, Cesar M. A.; Audino, Livia D.; Vaz-de-Mello, Fernando Z.; Fontoura, Fernanda M.; Guedes, Neiva M. R.";Brasileira;UNIDERP;MS;ECOLOGICAL ENTOMOLOGY;2.233;1;A2;"biodiversity conservation; burning sites; grasslands restoration; livestock management; Scarabaeinae; wetlands";"19°51S,56°17’”W; 19°58’S, 56°24’W";Campo;besouros;não;não;sim;não;coleta de campo;"The authors found that taxonomic and functional diversity of dung beetles weresimilar between unburned and burned grasslands, but with a distinct taxonomiccomposition post-fire. The functional traits composition was similar betweenunburned and burned sites, demonstrating that this metric is less sensitive to fireeffects in the Brazilian Pantanal; The study’s results provide evidence that dung beetles exhibit high resistance tothe occurrence of fire and fast recovery from its consequences. Thus, due to itsecological functions (secondary seed dispersion, nutrient cycling and others), theseinsects may assist ecological restoration of burned sites, being useful tools in resto-ration approaches for areas of the Pantanal that have been affected by fire.";;;;;;;;
25;Prioritising areas for wildfire prevention and post-fire restoration in the Brazilian Pantanal;2022;"Martins, Paula Isla; Coelho Belem, Liz Barreto; Szabo, Judit Kriszta; Libonati, Renata; Garcia, Leticia Couto";Brasileira;UFMS;MS;ECOLOGICAL ENGINEERING;4.379;1;A2;"Burnt area; Climate change; Fire ecology; Landscape management; Post-fire recovery; Tropical ecosystems";Pantanal;-;-;não;sim;não;não;Sensoriamento remoto;"We identified priority areas for wildfire prevention and areas degraded by fire; In the Pantanal, 246 km2 have high fire risk and fire-sensitive vegetation; Over 3120 km2 have been severely degraded by recent fires and need restoration; The cost of post-fire restoration for the priority areas is around USD 123 million.";;;;;;;;
26;Active Fire Mapping on Brazilian Pantanal Based on Deep Learning and CBERS 04A Imagery;2022;"Higa, Leandro; Marcato Junior, Jose; Rodrigues, Thiago; Zamboni, Pedro; Silva, Rodrigo; Almeida, Laisa; Liesenberg, Veraldo; Roque, Fabio; Libonati, Renata; Goncalves, Wesley Nunes; Silva, Jonathan";Brasileira;UFMS;MS;REMOTE SENSING;5.349;1;B2;"remote sensing; wildfire; object detection; convolutional neural network";Pantanal;-;-;não;não;não;não;Sensoriamento remoto;Our findings indicate that accurate results were achieved, even considering recent images from 2021, showing the generalization capability of our models to complement other researches and wildfire databases such as the current program Queimadas in detecting active fire in this complex environment. The approach may be extended and evaluated in other environmental conditions worldwide where active fire detection is still a required information in fire fighting and rescue initiatives;;;;;;;;
27;Assessing the role of compound drought and heatwave events on unprecedented 2020 wildfires in the Pantanal;2022;"Libonati, Renata; Geirinhas, Joao L.; Silva, Patricia S.; Russo, Ana; Rodrigues, Julia A.; Belem, Liz B. C.; Nogueira, Joana; Roque, Fabio O.; DaCamara, Carlos C.; Nunes, Ana M. B.; Marengo, Jose A.; Trigo, Ricardo M.";Brasileira;UFRJ;RJ;ENVIRONMENTAL RESEARCH LETTERS;6.947;1;B1;"Pantanal; Brazil; compound events; droughts; heatwaves; climate extremes; wildfires";Pantanal;-;-;não;não;sim;não;Sensoriamento remoto;The short span of the period during those compound drought-heatwave (CDHW) events accounted for 55% of the burned area of 2020. The vulnerability in the northern forested areas was higher than in the other areas, revealing a synergistic effect between fuel availability and weather-hydrological conditions. Accordingly, where fuel is not a limiting factor, fire activity tends to be more modelled by CDHW events. Our work advances beyond an isolated event-level basis towards a compound and cascading natural hazards approach, simultaneously estimating the contribution of drought and heatwaves to fuelling extreme fire outbreaks in the Pantanal such as those in 2020;;;;;;;;
33;The Pantanal is on fire and only a sustainable agenda can save the largest wetland in the world;2022;"Berlinck, C. N.; Lima, L. H. A.; Pereira, A. M. M.; Carvalho Jr, E. A. R.; Paula, R. C.; Thomas, W. M.; Morato, R. G.";Brasileira;ICMBio;MT;Brazilian Journal of Biology;;                                                                                                                                                                                                                                                                                                                                                                                                                                                                                                                                                                                                                                                                                                                                                                                                                                                                                                                                                                                                                                                                                                                                                                                                                    ;B3;;Pantanal;;;não;não;sim;não;Opinião;nota de opinião;;;;;;;;
37;Bird dependence on wetlands determines functional responses to flood pulse in the Brazilian Pantanal;2022;"Frota, Angelica Vilas Boas; Vitorino, Breno Dias; Almeida, Sara Miranda; da Silva Nunes, Josue Ribeiro; da Silva, Carolina Joana";Brasileira;UNEMAT;MT;ORNITHOLOGY RESEARCH;0,385;1;;"Floodplain; Functional diversity; Hydrological regimes; Seasonality; Waterbirds";"16°48?S, 57°24?W ;16°58?S ,57°40?W (Taimã)";várias;aves;não;não;não;sim;coleta de campo;Coloca o fogo como um elemento da paisagem;;;;;;;;
55;Compound impact of land use and extreme climate on the 2020 fire record of the Brazilian Pantanal;2022;"Ferreira Barbosa, Maria Lucia; Haddad, Isadora; da Silva Nascimento, Ana Lucia; Maximo da Silva, Gabriel; Moura da Veiga, Renata; Hoffmann, Tania Beatriz; Rosane de Souza, Anielli; Dalagnol, Ricardo; Susin Streher, Annia; Souza Pereira, Francisca R.; Cruz de Aragao, Luiz Eduardo; Oighenstein Anderson, Liana";Brasileira;INPE;SP;GLOBAL ECOLOGY AND BIOGEOGRAPHY;6.909;1;;"extreme weather; fires; land use; Pantanal; carbon loss";Pantanal;-;-;não;sim;não;não;Sensoriamento remoto;The unprecedented fires in 2020 were not only a result of atypical climate, but also a consequence of the intensification of fire-related human activities. Rural properties play a major role in Pantanal fires, requiring law enforcement and a consistent plan for increasing the protection of the conservation areas. We argue that ineffective fire prevention and the lack of suppression strategies were also key in enhancing the magnitude of these fires.;;;;;;;;
57;A compound event-oriented framework to tropical fire risk assessment in a changing climate;2022;"Ribeiro, Andreia F. S.; Brando, Paulo M.; Santos, Lucas; Rattis, Ludmila; Hirschi, Martin; Hauser, Mathias; Seneviratne, Sonia, I; Zscheischler, Jakob";Brasileira;ETH Zurich;Zurich;Environmental Research Letters;6.947;1;;"fire risks; compound events; global warming; Xingu; Pantanal";Pantanal;-;-;não;sim;não;não;Sensoriamento remoto;We show that concurrent air dryness (high vapour-pressure deficit (VPD)) and low precipitation have driven fire occurrence in both Xingu and the Pantanal, with VPD playing a dominant role. Historical climatic change has already increased compound event-related (CE-related) fire risks of all fire types (5%–10%), and these risks are likely to increase in the future due to global warming. The likelihood of CE-related increase in fire risk may be reduced by up to 14.4% if global warming is constrained to +1.5 ?C instead of +3 ?C. Nevertheless, substantially increased CE-related fire risks are still expected even if restricting global mean warming to 1.5 ?C, particularly in the Pantanal. We thus conclude that climate action should be coordinated with environmental protection to reduce ignition sources and promote effective conservation measures to preserve these biomes.;avaliou o risco de incêndios;;;;;;;
58;Evapotranspiration Seasonality over Tropical Ecosystems in Mato Grosso, Brazil;2022;"Biudes, Marcelo Sacardi; Geli, Hatim M. E.; Vourlitis, George Louis; Machado, Nadja Gomes; Pavao, Vagner Marques; Fabricio dos Santos, Luiz Octavio; Santos Querino, Carlos Alexandre";Brasileira;UFMT;MT;REMOTE SENSING;5.349;1;;"MOD16 ET; precipitation; EVI; Amazon; savanna hyper-seasonal; Pantanal";Pantanal de mato grosso;vários;-;não;não;não;sim;coleta de campo;The spatial variation of ET had some similarity to the climatology of Mato Grosso, with higher ET in the mid to southern parts of Mato Grosso (Cerrado and Pantanal) during the wet period compared to the dry period. The ET in the Amazon had three seasonal patterns, a higher and lower ET in the wet season compared to the dry season, and minimal to insignificant variation in ET during the wet and dry seasons. The wet season ET in Amazon decreased from the first and second decades, but the ET during the wet and dry season increased in Cerrado and Pantanal in the same period. This study highlights the importance of deepening the study of ET in the state of Mato Grosso due to the land cover and climate change.;fez em vários biomas;;;;;;;
59;Modeling of the air temperature using the Extreme Value Theory for selected biomes in Mato Grosso do Sul (Brazil);2022;"dos Reis, Carlos Jose; Souza, Amaury; Graf, Renata; Kossowski, Tomasz M.; Abreu, Marcel Carvalho; de Oliveira-Junior, Jose Francisco; Fernandes, Widinei Alves";Brasileira;UFLA;MG;STOCHASTIC ENVIRONMENTAL RESEARCH AND RISK ASSESSMENT;3.821;1;;"Air temperature;Extreme Value Theory;Climate change;Probability distribution;Biomes;Brazil";Pantanal;-;-;não;não;não;sim;Sensoriamento remodo/base de dados;Deforestation, combustion and extensive fires, and therelated aerosol emissions contribute, alongside climate change, to the generation of extreme air temperatures in the studiedbiomes.;;;;;;;;
60;Variation of Ozone in the Pantanal Environment Based on Probability Distributions;2022;"de Souza, Amaury; Francisco Junior, Jose; Abreu, Marcel Carvalho; Aristone, Flavio; Fernandes, Widinei Alves; Casaes Nunes, Raquel Soares; Cavazzana, Guilherme Henrique; Dos Santos, Cicero Manoel; Reis, Carlos Jose; Dumka, Umesh";Brasileira;UFMS;MS;OZONE-SCIENCE & ENGINEERING;2.604;1;;"Probability function;ozone;climate change;wetland;pollution;health";Pantanal;-;-;não;não;não;sim;Sensoriamento remoto;In most months investigated, the Pantanal follows the GUM and GEV probability distributions. In addition, monthly means of O3 and standard deviations were calculated. It is worth mentioning the variability of O3 and the impact on climate change.;;;;;;;;
61;Spatial-Temporal Variability of the Ozone Column over the Brazilian Midwest from Satellite Data from 2005 to 2020;2022;"de Souza, Amaury; de Oliveira-Junior, Jose Francisco; Abreu, Marcel Carvalho; Cavazzana, Guilherme Henrique";Brasileira;UFMS;MS;WATER AIR AND SOIL POLLUTION;2.984;1;;"Total ozone column; Ozone temporal and spatial variation; OMI; AUREA; Time series";Pantanal;-;-;não;sim;não;não;sensoriamanto remoto;The monthly average values of TOC show maximum values in September and minimum values in June in all seasons. Monthly spatial behavior (TOC) is greater in the south/southwest (S/SW) and SW of MS than in the central and northern (N) parts.;estudou várias cidades de mato Grosso do sul, nos diferentes biomas.;;;;;;;
83;Human risk assessment of ash soil after 2020 wildfires in Pantanal biome (Brazil);2022;"Caumo, S; Lazaro, WL; Oliveira, ES; Beringui, K; Gioda, A; Massone, CG; Carreira, R; De Freitas, DS; Ignacio, ARA; Hacon, S";brasileira;FIOCRUZ;RJ;Air Quality, Atmosphere & Health;3.763;1;;Wildfire · Pantanal · Trace elements · Polycyclic aromatic hydrocarbons · Risk assessment;at https:// doi. org/ 10. 1007/ s11869- 022- 01248-2.;-;-;não;não;sim;não;amostras de solo;The carcinogenic risks exceeded reference values, for both TE and PAH, suggesting harmful conditions, especially for vulnerable groups, such as children and the elderly.;;;;;;;;
84;Brazil has experienced unprecedented wildfires in the last decade. Images of immense burnt areas or dead animals that failed to escape the 2020 wildfires have shocked the world. To prevent or minimize further similar disasters we must understand the factors that have led to these catastrophic events. The causes and consequences of wildfires entail complex interactions between the biophysical and sociocultural spheres, and suitable management decisions require a sound scientific base. We present the recent panorama of increasing fire outbreaks in the Brazilian biomes, and discuss the causes that have contributed to such fires, their impacts on the environment and overall consequences for human well-being, based on reviewing the extensive specialist literature, on authors' expert knowledge and information provided by environmental managers, researchers and politicians during a workshop organized to debate the wildfire issue in Brazil. Our up-to-date review is aimed at the academic public, environmental managers and decision-and policy-makers. First, we present evidence on the contrasting effects of fire on different ecosystems. Second, we outline the historic perceptions and policies related to fire use and management in Brazil since its colonization to the present date. Third, we propose means to advance fire prevention and develop successful management strategies. Finally, we answer frequently asked questions to clarify and/or demystify some fire-related issues not always properly addressed in the media.;2021;"Pivello, VR; Vieira, I; Christianini, AV; Ribeiro, DB; Menezes, LD; Berlinck, CN; Melo, FPL; Marengo, JA; Tornquist, CG; Tomas, WM; Overbeck, GE";Brasileira;USP;AP;Perspectives in Ecology and Conservation;5.652;1;;Fire ecology, Fire-dependent ecosystems, Fire-sensitive ecosystems, Fire management, Fire research gaps, Wildfires;biomas;biomas;-;não;sim;não;não;opinião;To effectively reduce fires and their negative effects, Brazil needs a long-term commitment with conservation and sustainable development that considers the distinct ecological, socio-economic and cultural realities across the country.;;;;;;;;
85;Wildfire Incidence throughout the Brazilian Pantanal Is Driven by Local Climate Rather Than Bovine Stocking Density;2022;"Teodoro, Paulo Eduardo; Maria, Luciano de Souza; Almeida Rodrigues, Jessica Marciella; e Silva, Adriana de Avila; Metzdorf da Silva, Maiara Cristina; de Souza, Samara Santos; Rossi, Fernando Saragosa; Ribeiro Teodoro, Larissa Pereira; Della-Silva, Joao Lucas; Delgado, Rafael Coll; Lima, Mendelson; Peres, Carlos A.; da Silva Junior, Carlos Antonio";Brasileira;UFMS;MS;SUSTAINABILITY;3.889;1;;"biome; biomass; gross primary production; Standardized Precipitation Index";bioma;bioma;-;não;sim;não;não;sensoriamento remoto e dados secundários;Gross primary productivity further invalidated the “cattle herbivory” hypothesis because GPP was found to be strongly correlated with cattle density but not with the spatial distribution of fires. Fires throughout the Pantanal are currently aggravated by the presence of livestock and result from a combination of extreme weather events and outdated agricultural practices.;;;;;;;;
86;Heatwaves and fire in Pantanal: Historical and future perspectives from CORDEX-CORE;2022;"Silva, Patricia S.; Geirinhas, Joao L.; Lapere, Remy; Laura, Wil; Cassain, Domingo; Alegria, Andres; Campbell, Jayaka";Portuguesa;Instituto Dom Luis;Portugal;JOURNAL OF ENVIRONMENTAL MANAGEMENT;6.789;1;;"Pantanal; Burned area; Heatwaves; CORDEX-CORE; RCP; Fire";bioma;bioma;-;não;sim;não;não;sensoriamento remoto e dados secundários;Accordingly, favorable conditions for fire spread and consequent large burned areas are expected to occur more often in the future, posing a dramatic short-term threat to the ecosystem if no preservation action is undertaken posing a dramatic short-term threat to the ecosystem if no preservation action is undertaken;;;;;;;;
87;2020 Pantanal's widespread fire: short- and long-term implications for biodiversity and conservation;2021;"Mataveli, Guilherme A. V.; Pereira, Gabriel; de Oliveira, Gabriel; Seixas, Hugo T.; Cardozo, Francielle da S.; Shimabukuro, Yosio E.; Kawakubo, Fernando S.; Brunsell, Nathaniel A.";Brasileira;INPE;SP;BIODIVERSITY AND CONSERVATION;3.549;1;;"Wetlands; Drought; Burning; Biodiversity Threat; Conservation";bioma;bioma;-;não;sim;não;não;sensoriamento remoto e dados secundários;Approximately 95 % of these active fires occurred in natural land covers with 28 % of them occurring in areas classified as wetlands that likely dried out due to the drought. Therefore, the development of a special policy is needed to minimize the impact of this crisis on the biodiversity, conservation, and traditional people of the Pantanal.;;;;;;;;
88;Temporal and spatial patterns of fire activity in three biomes of Brazil;2022;"Abreu, Marcel Carvalho; Lyra, Gustavo Bastos; de Oliveira-Junior, Jose Francisco; Souza, Amaury; Pobocikova, Ivana; de Souza Fraga, Micael; Abreu, Rodolfo Cesar Real";Brasileira;UFRRJ;RJ;SCIENCE OF THE TOTAL ENVIRONMENT;10.753;1;;"Environmental satellites; Probabilistic density functions; Pantanal; Atlantic Forest; Cerrado; Land use and land cover";Biomas;biomas;-;não;sim;não;não;sensoriamento remoto e dados secundários;There was a strong correlation between fire and agricultural areas, with increasing trends pointing to land conversion to agricultural areas in all biomes. The high probability of fire indicates that expanding agricultural areas through the conversion of natural biomes impacts several natural ecosystems, transforming land cover and land use. This land conversion is promoting more fires each year.;;;;;;;;
